sb43y1cl,5a33a08f682045245c8dffd03a701072421b9f4f,Elsevier,Purification and biophysical properties of human coronavirus 229E,10.1016/0042-6822(76)90014-3,,,els-covid,"Abstract Coronavirus 229E was grown to high titers in diploid fibroblast cells under medium containing twice the normal concentrations of amino acids and vitamins. Growth curves showed maximum virus production at multiplicities of infection of 0.1 and 1; maximum titers of intracellular virus occurred at 22–24 hr and of extracellular virus at 26 hr postadsorption. Tube infectivity titers ranged from 109.0–109.5 TCID50/ml and plaque titers from 1010.2–1010.9 y PFU/ml at the time of peak virus production, when no cytopathology was evident. Virus titer dropped rapidly between 26 and 56 hr, coincident with increasing cytopathology. A single precipitin band was observed in immunodiffusion and immunoelectrophoresis between concentrated virus preparations and antiserum to purified 229E. Neuraminidase and hemagglutinin assays were negative. Virus was purified by two procedures: adsorption to and elution from human “0” erythrocytes and CaHPO4 gel followed by equilibrium sucrose gradient centrifugation, and PEG precipitation followed by equilibrium glycerol/tartrate gradients and rate zonal sucrose or glycerol/tartrate gradients. Final lots of purified virus containing <0.02% of the crude tissue culture proteins had absorption maxima at 256 nm and minima at 241.2 nm and a mean extinction coefficient of E 1cm 1% = 54.3 at 256 nm. The fully corrected sedimentation coefficient for the intact virion was S 20,v 0 = 381 S. PAGE by different techniques revealed seven polypeptides of mean apparent molecular weights between 16,900 and 196,100. Six contained carbohydrate and one contained lipid. Electropherograms of 3H- and 14C-labeled virus were identical to those of stained gels. Two glycoproteins constituting 25% of the virion protein were identified by bromelin digestion as the spike proteins. The density in sucrose and in potassium tartrate was 1.18 g/ml for the virion and 1.15 g/ml for the “despiked” particle.",11/30/1976,"Hierholzer, John C.",Virology,,,TRUE,FALSE,custom_license,https://doi.org/10.1016/0042-6822(76)90014-3
whwksoxt,b6e753f1d598feaca24c0a19464fe7e2c503cc31,Elsevier,The RNA of human coronavirus OC-43,10.1016/0042-6822(77)90126-x,,194396,els-covid,"Abstract A homogeneous RNA complex with a sedimentation coefficient of 70 S and an apparent molecular weight of approximately 6.1 × 106 was released from purified 32P-labeled, mouse-brain-derived OC-43 virus after treatment with 1% sodium dodecyl sulfate (SDS) for 15 min at 23°. The complex was highly susceptible to heat, releasing 4 S RNA fragments at 37° and breaking down to fragments of 4–70 S at 60°; it was also degraded by centrifugation through dimethyl sulfoxide gradients. Unlike tobacco mosaic virus or Rous sarcoma virus RNA, OC-43 RNA prepared by extraction with phenol-SDS or phenol-chloroform degraded into a range of fragments with coefficients of 15–55 S; 4 S RNA was also present as a minor component. This suggests that (a) extensive nicking of a large RNA molecule has occurred during viral growth, due to ribonucleases which are inactivated during phenol extractions; (b) heterogeneity for OC-43 RNA is not due to internal ribonuclease activity and fragments are held together by noncovalent linkages much weaker than those present in the 70 S retroviral RNA complex, or by small proteins; or, most probably, (c) a combination of extensive nicking and weak noncovalent linkages results in the heterogeneous denaturation products.",12/31/1977,"Tannock, Gregory A.; Hierholzer, John C.",Virology,,,TRUE,FALSE,custom_license,https://doi.org/10.1016/0042-6822(77)90126-x
1v9fcmom,ad5ca5b8e559a2cad209b42e36e37eb6732b1267,Elsevier,Characterization of a coronavirus I. Structural proteins: Effects of preparative conditions on the migration of protein in polyacrylamide gels,10.1016/0042-6822(77)90488-3,,855186,els-covid,"Abstract Coronavirus A59 possesses four size classes of structural proteins which have apparent molecular weights measured by SDS-polyacrylamide gel electrophoresis (SDS-PAGE) of 23,000 (GP23), 50,000 (VP50), 90,000 (GP90), and 180,000 (GP180). VP50 is the only structural protein which is completely unaffected by protease treatment of intact virions. This species is the most highly labeled by polar amino acids such as glutamic acid and arginine and it is probably associated with the viral nucleocapsid. GP90, GP180, and GP23 are membrane-associated proteins. However, after protease treatment of virions, only 20% of the GP23 molecule is digested, whereas all of the GP90 and GP180 are removed. GP90 and GP180 appear to comprise most of the prominent layer of characteristic projections on the external surface of the viral envelope. The major portion of GP23 is presumed to lie within the lipid envelope, protected from protease digestion. GP23 and the protease resistant portion, p∗18, exhibit anomalous behavior on SDS-PAGE. After heating to 100° in SDS the electrophoretic mobility of these polypeptides is altered and several new forms of lower mobility are produced. β-Mercaptoethanol and dithiothreitol exaggerate the effects of heating.",4/30/1977,"Sturman, Lawrence S.",Virology,,,TRUE,FALSE,custom_license,https://doi.org/10.1016/0042-6822(77)90488-3
7900h4gn,db6d281e44875a2e00a93bcdd68a47307a6ecc31,Elsevier,Characterization of a coronavirus II. Glycoproteins of the viral envelope: Tryptic peptide analysis,10.1016/0042-6822(77)90489-5,,855187,els-covid,"Abstract Two species of membrane-associated glycoproteins have been identified in the coronavirus virion. They are readily distinguished on the basis of size, radiolabeling characteristics, and location in relation to the lipid bilayer. The larger glycoprotein is highly labeled by both radiolabeled fucose and glucosamine. This species is found in two forms, GP180 and GP90, with apparent molecular weights of 180,000 and 90,000. GP180 can be converted to GP90 in vitro by treatment of virions with trypsin. Analysis of tryptic digests of GP90 and GP180 give identical peptide patterns. Based on pronase and bromelain sensitivities, GP180/90 is the only protein which is located entirely external to the viral envelope. It appears to comprise the characteristic long, petal-shaped peplomers of the virion. The smaller glycoprotein, GP23, has an apparent molecular weight of 23,000 and is labeled by radiolabeled glucosamine but not by fucose. The level of glucosamine-labeling of GP23 is about 1/10 that of GP180/90. GP23 appears to possess two distinct domains: a smaller, carbohydrate containing region which is found outside the viral envelope, and a larger portion, highly labeled by methionine, which is integrally associated with the viral membrane. A new nomenclature is proposed for the three major coronavirus structural proteins. The two envelope glycoproteins, GP23 and GP180/90 are designated E1 and E2, respectively; the inner core protein, VP50, is designated N.",4/30/1977,"Sturman, Lawrence S.; Holmes, Kathryn V.",Virology,,,TRUE,FALSE,custom_license,https://doi.org/10.1016/0042-6822(77)90489-5
tcrw7lzd,,Elsevier,Presence of infectious polyadenylated RNA in the coronavirus avian bronchitis virus,10.1016/0042-6822(77)90498-6,,193262,els-covid,"Abstract Avian infectious bronchitis virus (IBV) was radiolabeled for its nucleic acid component by growth in deembryonated chicken eggs. Purified virions of IBV have a buoyant density in linear sucrose gradients of 1.17-1.18 g/cm3 and contain approximately 4% RNA by weight. The genomic ribonucleic acid of IBV shows the following characteristic: (1) It consists of one size class of single-stranded RNA having a molecular weight of 5.5-5.7 x 108 and a sedimentation coefficient of about 48 S; (2) no evidence for subunit structure is apparent since the RNA resolves as a single species with the same electrophoretic mobility in polyacrylamide gels before and after heat denaturation; (3) at least 20–30% of the RNA molecules extracted from purified virions contain sequences of polyadenylic acid of approximately 4 S size; (4) RNA obtained from detergent-disrupted virus particles by phenol-chloroform extraction is infectious for cultures of chick embryo fibroblasts, giving rise to progeny virus which is lethal for embryonated eggs. These findings, together with the observation that IBV virions do not exhibit detectable transcriptase activity, support the conclusion that the genome of this coronavirus acts directly as a messenger RNA in eukaryotic cells.",4/30/1977,"Schochetman, Gerald; Stevens, Roy H.; Simpson, Robert W.",Virology,,,FALSE,FALSE,custom_license,https://doi.org/10.1016/0042-6822(77)90498-6
m9j3pcj1,5610c53dce08ee3038eade1231d7d6d0fc6a8ad9,Elsevier,Resolution of the major poliovirus capsid polypeptides into doublets,10.1016/0042-6822(78)90093-4,,27002,els-covid,"Abstract Using the pH gradient electrophoretic technique of Vrijsen and Boeyé, the coat protein of poliovirus types 1 and 2 was resolved into six components, Cl to C6, instead of the classical VP1-2-3 (the much smaller polypeptide VP4 was excluded from this study). The multiple components ran true upon reelectrophoresis, and there were no technical artifacts. Their resolution did not depend on a particular method for the preparation or disruption of the virion. The C1–C6 components of pH gradient electrophoresis and the classical VP1–VP3 polypeptides were examined with regard to (i) their migration in normal and pH gradient reelectrophoresis and (ii) their kinetics of leucine incorporation in emetine-stopped pulses. It is concluded that C1 and C2 were both derived from VPl, C3 and C4 from VP2, and C5 and C6 from VP3.",5/15/1978,"Vrijsen, R.; Wouters, M.; Boeye, A.",Virology,,,TRUE,FALSE,custom_license,https://doi.org/10.1016/0042-6822(78)90093-4
nl5kmmtd,3a2ff3a86c4b06fb35f0422034ce8c65f7ca0bd3,Elsevier,Intestinal influenza: Replication and characterization of influenza viruses in ducks,10.1016/0042-6822(78)90247-7,,23604,els-covid,"Abstract Influenza A viruses isolated from the cloaca of naturally infected feral ducks replicate in the lungs and in the cells lining the intestinal tract of feral and domestic ducks. Despite the low pH of the gizzard, the duck influenza viruses reach the intestines via the digestive tract and are found in high concentration in the feces. The viruses retain infectivity in fecal material for at least 30 days at 4° and for 7 days at 20°. The morphology of one strain of intestinal duck influenza virus (Hav7 Neg2) that had never been passed in embryonated eggs and was isolated from the feces was roughly spherical and fairly uniform in size and shape. However, another strain of duck influenza virus studied (Hav3 Nav6) was predominantly filamentous, suggesting that the morphology of influenza viruses in their natural hosts varies from strain to strain. After passage in the chick embryo each strain retained the morphological characteristics found in the feces. In contrast to duck influenza viruses, representative human influenza viruses of the HON1, H3N2, and Hswl Nl subtypes replicate only in the upper respiratory tract of ducks. The duck influenza viruses are more stable to low pH than human strains and retain infectivity for over 30 days in nonchlorinated river water at 0° and for 4 days at 22°. The susceptibility of ducks to infection with human and avian strains of influenza virus and the possibility of transmission to animal species through the water supply suggests that ducks may be important in the ecology of influenza viruses. The possibility of “intestinal influenza” virus vaccines is considered.",2/28/1978,"Webster, Robert G.; Yakhno, Maya; Hinshaw, Virginia S.; Bean, William J.; Copal Murti, K.",Virology,,,TRUE,FALSE,custom_license,https://doi.org/10.1016/0042-6822(78)90247-7
3dctmmfe,9d5f75e025f6ba577403aab0eba629ac9433c3a4,Elsevier,In vivo and in vitro models of demyelinating diseases II. Persistence and host-regulated thermosensitivity in cells of neural derivation infected with mouse hepatitis and measles viruses,10.1016/0042-6822(78)90289-1,,211715,els-covid,"Abstract Following inoculation of continuous cell lines of neural and other derivations, persistent infections are established with facility by mouse hepatitis and measles viruses. This occurs equally with the prototype MHV3 and its neurotropic variant JHM as well as with the Edmonston vaccine and SSPE Hallé measles variants. In almost every instance that the infection becomes persistent at 32.5°, virus replication is found to be thermosensitive at 39.5°; however, progeny virus derived from such infections at 32.5° is itself thermostable when replicating in the indicator, fully permissive cell lines. The new data, therefore, reveal the existence of a host-conferred interrelationship between persistence and virus restriction at elevated temperature. They indicate that the two agents with neurotropic potential, when they become established as pathogens in the nervous system, could be under close host cell regulation involving as yet unknown mechanisms.",7/15/1978,"Lucas, Alexandra; Coulter, Marion; Anderson, Robert; Dales, Samuel; Flintoff, Wayne",Virology,,,TRUE,FALSE,custom_license,https://doi.org/10.1016/0042-6822(78)90289-1
pv4sjsbp,35986d93702911ced2b8f81686d04909ac40c5b5,Elsevier,Virus-induced diabetes mellitus. X. Attachment of encephalomyocarditis virus and permissiveness of cultured pancreatic β cells to infection,10.1016/0042-6822(78)90465-8,,208240,els-covid,"Abstract Monolayers of pancreatic β-cells from strains of mice susceptible (SJL/J) and resistant (C57BL/6J) to the development of virus-induced diabetes mellitus were inoculated with the M variant of encephalomyocarditis (EMC) virus. Immunofluorescence showed that viral antigens appeared in up to 10 times more β cells from susceptible SJL/J mice than from resistant C57BL/6J mice. Infectious center assays revealed that 10–30 times more SJL/J β cells contained infectious virus than C57BL/6J β cells. Viral attachment experiments showed no difference in the binding of EMC virus when embryonic fibroblasts, pancreatic fibroblasts, and kidney cells from SJL/J and C57BL/6J mice were compared. However, at least twice as much virus attached to the pancreatic β cells from susceptible than from resistant strains of mice. Our data suggest that genetically determined differences in viral receptors on the surface of β cells may be one of the factors controlling susceptibility to EMC-induced diabetes mellitus.",4/30/1978,"Chairez, Ruben; Yoon, Ji-Won; Notkins, Abner Louis",Virology,,,TRUE,FALSE,custom_license,https://doi.org/10.1016/0042-6822(78)90465-8
fvrhzc7x,2cd35285dc4881d52dbd8c1887576424a0457491,Elsevier,Pathogenic murine coronaviruses I. Characterization of biological behavior in vitro and virus-specific intracellular RNA of strongly neurotropic JHMV and weakly neurotropic A59V viruses,10.1016/0042-6822(79)90467-7,,572112,els-covid,"Abstract JHM virus (JHMV) and A59 virus (A59V) are neurotropic members of the hepatoencephalitis group of murine coronaviridae. JHMV has a markedly greater neurotropism for weanling BALB/c mice than does A59V. Both viruses display one-hit kinetics when grown in vitro in 17CL-16 cells, a clone of BALB/c3T3 cells. Virus-specific intranuclear, cytoplasmic, and surface antigens have been observed for both viruses by immunofluorescence. The intranuclear antigen appears first at about 2 hr after infection (hpi) followed by the development of the cytoplasmic and surface antigens at 3 hpi at 38.5°. Most, if not all cells that develop the intranuclear antigen, produce cytoplasmic antigen and presumably progeny virus. Progeny virus production is independent of cell fusion and formation of syncytia. Virus-specific ribonucleoprotein is synthesized in the presence of 1 μg/ml actinomycin D, a concentration sufficient to inhibit the synthesis of cellular ribonucleoprotein species that have sedimentation properties similar to the virus-specific species. The virus-specific ribonucleoprotein species that is resistant to 10 mM EDTA, presumptive virion ribonucleoprotein, has a sedimentation value in sucrose of about 230 S for JHMV and 200 S for A59V. The species of virus-specific ribonucleoprotein that are sensitive to 10 mM EDTA presumptive messenger ribonucleoprotein, are about 40–100 S in sucrose for both viruses. The purified presumptive virion RNA is about 50 S in sucrose for both viruses. The major species of presumptive mRNA of both viruses is about 18 S with secondary species of about 28 S in sucrose. Denaturation of the virus-specific RNA with heat and dimethylsulfoxide does not appreciably alter the sedimentation profiles of either the presumptive virion RNA or mRNA species.",4/30/1979,"Robb, James A.; Bond, Clifford W.",Virology,,,TRUE,FALSE,custom_license,https://doi.org/10.1016/0042-6822(79)90467-7
p2antw37,a2d70293914db6f221a7594f454a4b6f613b9a6a,Elsevier,Pathogenic murine coronaviruses II. Characterization of virus-specific proteins of murine coronaviruses JHMV and A59V,10.1016/0042-6822(79)90468-9,,572113,els-covid,Abstract We have identified nine intracellular virus-specific proteins in cells infected with JHMV or A59V. Seven virus-specific proteins were detected by sodium dodecyl sulfate-polyacrylamide gel electrophoresis and two additional virus-specific proteins were detected by two-dimensional gel electrophoresis. The A59V- and JHMV-specific proteins differ slightly in molecular weight. Four of the nine proteins are structural proteins. The synthesis of the nine virus-specific proteins is noncoordinate with respect to time.,4/30/1979,"Bond, Clifford W.; Leibowitz, Julian L.; Robb, James A.",Virology,,,TRUE,FALSE,custom_license,https://doi.org/10.1016/0042-6822(79)90468-9
icehbtkc,64e28239246860c5c9f39e62a3b78ce8eebb6f02,Elsevier,Pathogenic murine coronaviruses III. Biological and biochemical characterization of temperature sensitive mutants of JHMV,10.1016/0042-6822(79)90469-0,,452421,els-covid,"Abstract JHMV is a neurotropic member of the hepatoencephalitis group of murine coronaviridae. The characteristics of the biology and intracellular viral RNA synthesis and the intracellular viral protein synthesis of JHMV are discussed in the two previous papers, respectively. This paper describes the neuropathogenesis of JHMV and the isolation and characterization of 34 temperature-sensitive mutants of JHMV. These mutants were selected for their inability to induce syncytia formation after low multiplicity infection (m.o.i. = 0.1 iU) in BALB/c 17CL-1 cells at 38.5° as compared to the induction of syncytia at 33°. N-Methyl-N′-nitrosoguanidine (14 mutants) and 5-fluorouridine (20 mutants) were used as mutagens at a concentration that reduced infectivity by 90–95%. Characterization of these mutants included: induction of syncytia; synthesis of JHMV-specific intracellular RNA; progeny yields at 33, 37, and 38.5°; synthesis of JHMV-specific antigens as determined by indirect immunofluorescence and sodium dodecyl sulfate-polyacrylamide gel electrophoresis; virion thermostability; neuropathogenesis including isolation of virus from infected brain, immunofluorescence of infected brain, and histopathology of brain and spinal cord by light and transmission electron microscopy; ability to protect mice from a lethal JHMV infection; and complementation. RNA-minus ( 17 34 ), RNA-intermediate ( 14 34 ), and RNA-plus ( 3 34 ) groups were defined. One mutant, N3, produces chronic meningitis and demyelination without typical JHMV encephalitis in spite of the fact that neurons are infected as detected by immunofluorescence. This altered neuropathogenesis cannot be explained by “leakiness” or reversion. In addition, non-temperature-sensitive variants of JHMV have been selected for altered neuropathogenesis and are described.",4/30/1979,"Robb, James A.; Bond, Clifford W.; Leibowitz, Julian L.",Virology,,,TRUE,FALSE,custom_license,https://doi.org/10.1016/0042-6822(79)90469-0
b6rmlpcv,f21c95ba9743114144b44a49985e05a405920b29,Elsevier,Characterization of the cold-sensitive murine hepatitis virus mutants rescued from latently infected cells by cell fusion,10.1016/0042-6822(79)90567-1,,228481,els-covid,"Abstract Mouse hepatitis virus, a coronavirus, was rescued from latently infected mouse neuroblastoma cells by polyethylene glycol-induced fusion to permissive cells. The isolated viruses grew to equal or higher titers than parental JHM virus at 39° but were restricted in replication at 32° and hence were cold-sensitive mutants. Neither isolate synthesized RNA at the nonpermissive temperature (32°), and temperature shift experiments indicated that the restrictive cold-sensitive step in replication occurred during an early viral function. The isolates were unable to complement each other at 32°. Although coinfection between each mutant and parental JHM virus often resulted in decreased yields of both infecting viruses, interference could not be convincingly demonstrated. Both mutants were more thermostable than parental JHM virus and could be distinguished from each other and from parental JHM virus by their thermal inactivation kinetics. The isolates were obtained from single cell clones and therefore presumed to be homogeneous; however, thermal inactivation of one (S-3JHM) indicated the possible existence of a second population. Subclones of virus prepared from each isolate were also found to be thermally stable and to retain the cold sensitive defect. No indication of a second population of S-3JHM virus was detected.",10/30/1979,"Stohlman, Stephen A.; Sakaguchi, Alan Y.; Weiner, Leslie P.",Virology,,,TRUE,FALSE,custom_license,https://doi.org/10.1016/0042-6822(79)90567-1
mvv1rg68,ba23ef78f7b162ec4ec37741a73e9984b6b63c94,Elsevier,The coronavirus avian infectious bronchitis virus requires the cell nucleus and host transcriptional factors,10.1016/0042-6822(80)90058-6,,6158788,els-covid,"Abstract Replication of avian infectious bronchitis virus in permissive BHK-21 cells is blocked when these cells are enucleated or irradiated with ultraviolet light prior to infection, or if cells are treated with α-amanitin during the virus growth cycle. This coronavirus, like influenza virus, can replicate normally in the presence of α-amanitin in Chinese hamster ovary cells which possess a drug-resistant RNA polymerase II. These findings indicate that avian infectious bronchitis virus requires the intact cell nucleus and one or more host transcriptional functions for productive infections. Preliminary data suggest that these cellular functions involve some aspect of virus-directed RNA synthesis.",9/30/1980,"Evans, Martin R.; Simpson, Robert W.",Virology,,,TRUE,FALSE,custom_license,https://doi.org/10.1016/0042-6822(80)90058-6
i44di6y3,c53f6ab8542fa870daf7f632b827128f87bd821b,Elsevier,Effect of sulfhydryl reagents on the infectivity of vesicular stomatitis virus,10.1016/0042-6822(80)90517-6,,6243427,els-covid,"Abstract The infectivity of vesicular stomatitis virus (VSV) was moderately affected by iodoacetic acid and drastically affected by N-ethylmaleimide; the antiviral effect of these sulfhydryl reagents was enhanced somewhat by the reducing agent, 2-mercaptoethanol. Reducing and/or alkylating reagents did not affect VSV hemagglutination and the impermeable sulfhydryl reagent, dextran-maleimide, did not significantly influence VSV infectivity. These data indicate that glycoprotein spikes are not the major sites for the antiviral activity of sulfhydryl reagents. [14C]Iodoacetic acid was able to penetrate the virion membrane to bind covalently to the free sulfhydryl groups of all five virion proteins, particularly the reduced disulfides of the L protein. The RNA polymerase activity of intact VSV was inhibited by iodoacetic acid and to a greater extent by N-ethylmaleimide, which probably accounts for the loss of viral infectivity caused by the permeable sulfhydryl reagents.",1/30/1980,"Beatrice, Sara T.; Wagner, Robert R.",Virology,,,TRUE,FALSE,custom_license,https://doi.org/10.1016/0042-6822(80)90517-6
5sc821fe,cdbfd95d3c2885348d95a391e4ca2f9667c48beb,Elsevier,The replication of murine coronaviruses in enucleated cells,10.1016/0042-6822(81)90027-1,,6259831,els-covid,"Abstract Coronaviruses JHMV and A59V have been shown to replicate, produce viral-specific antigens and cytopathic effects (CPE) in enucleated 17CL-1 cells.",4/15/1981,"Wilhelmsen, Kirk C.; Leibowitz, Julian L.; Bond, Clifford W.; Robb, James A.",Virology,,,TRUE,FALSE,custom_license,https://doi.org/10.1016/0042-6822(81)90027-1
