vt1sp5ai,a83f5d24cde3a8d49d4f37e4982085b8194a1252,Elsevier,Oligomerization is essential for transport of vesicular stomatitis viral glycoprotein to the cell surface,10.1016/0092-8674(86)90075-9,,3019557,els-covid,"Abstract Using ts045, a temperature sensitive strain of Vesicular stomatitis virus, we show that oligomerization of G protein is a prerequisite for its transport from RER to the Golgi apparatus and for its subsequent maturation. While wild-type G forms an oligomer in the RER, ts045 G synthesized at the nonpermissive temperature does not. When the permissive temperature is reinstated, ts045 G forms an oligomer and moves to the Golgi. The state of oligomerization was determined by chemical cross-linking and by the ability of a microinjected monoclonal antibody specific for the carboxy-terminal five amino acids of the cytoplasmic tail of G to cause patching of G in intracellular membranes. We conclude that formation of an oligomer of G protein, probably a trimer, is necessary for G protein maturation.",9/12/1986,"Kreis, Thomas E.; Lodish, Harvey F.",Cell,,,TRUE,FALSE,custom_license,https://doi.org/10.1016/0092-8674(86)90075-9
p0nwbgun,047d29cfae5f3643475182d76da505f57b43db20,Elsevier,The mechanism of RNA recombination in poliovirus,10.1016/0092-8674(86)90600-8,,3021340,els-covid,"Abstract We have investigated RNA recombination among poliovirus genomes by analyzing both intratypic and intertypic recombinant crosses involving the same defined genetic markers. Sequence analysis of the recombinant junctions of 13 nonsibling intertypic recombinants showed that intertypic RNA recombination is not site-specific, nor does it require extensive homology between the recombining parents at the crossover site. To discriminate between breaking-rejoining and copy choice mechanisms of RNA recombination, we have inhibited the replication of the recombining parents independently and found opposite effects on the frequency of genetic recombination in intratypic crosses. The results strongly support a copy choice mechanism for RNA recombination, in which the viral RNA polymerase switches templates during negative strand synthesis.",11/7/1986,"Kirkegaard, Karla; Baltimore, David",Cell,,,TRUE,FALSE,custom_license,https://doi.org/10.1016/0092-8674(86)90600-8
0fu5h64z,2d1428c1b0b4af758faf454ab1d2893468c5318a,Elsevier,Evidence for Trans splicing in trypanosomes,10.1016/0092-8674(86)90617-3,,3022935,els-covid,"Abstract The 5′ ends of trypanosome mRNAs consist of an identical sequence of 35 nucleotides. This “mini-exon” sequence is derived from the 5′ end of a 137 nucleotide RNA (medRNA). The remainder of each mRNA is derived from a protein-coding exon that is not linked to the mini-exon. We propose that medRNA is spliced in trans to de-novo-initiated transcripts of protein-coding genes. This trans splicing model predicts that the downstream portion of medRNA will be part of a branched structure and then be released as a free product (minRNA). We demonstrate that significant levels of minRNA exist in trypanosome RNA. Furthermore, minRNA can be released from high molecular weight RNA by a HeLa cell S100 “debranching” extract. We conclude that trnas splicing is the physiological process by which mature mRNA molecules are synthesized in trypanosomes.",11/21/1986,"Sutton, Richard E.; Boothroyd, John C.",Cell,,,TRUE,FALSE,custom_license,https://doi.org/10.1016/0092-8674(86)90617-3
bli8hwda,9b370f9b62666750df6efbabe7efa6811ee8c338,Elsevier,The membrane-spanning segment of invariant chain (Iγ) contains a potentially cleavable signal sequence,10.1016/0092-8674(86)90710-5,,3530500,els-covid,"Abstract The human invariant chain (Iγ) of class II histocompatibility antigens spans the membrane of the endoplasmic reticulum once. It exposes a small amino-terminal domain on the cytoplasmic side and a carboxyterminal, glycosylated domain on the exoplasmic side of the membrane. When the exoplasmic domain of Iγ is replaced by the cytoplasmic protein chloramphenicol acetyltransferase (CAT), CAT becomes the exoplasmic, glycosylated domain of the resulting membrane protein IγCAT∗. Deletion of the hydrophilic cytoplasmic domain from IγCAT gives rise to a secreted protein from which an amino-terminal segment is cleaved, most likely by signal peptidase. We conclude that the membrane-spanning region of Iγ contains a signal sequence in its amino-terminal half and that hydrophilic residues at the amino-terminal end of a signal sequence can determine cleavage by signal peptidase.",9/26/1986,"Lipp, Joachim; Dobberstein, Bernhard",Cell,,,TRUE,FALSE,custom_license,https://doi.org/10.1016/0092-8674(86)90710-5
so5jooj0,e54c0a07b76e9b5ae145e81a0b44cde27b923f76,Elsevier,Vaccinia virus produces late mRNAs by discontinuous synthesis,10.1016/0092-8674(87)90211-x,,3036368,els-covid,"Abstract We describe the unusual structure of a vaccinia virus late mRNA. In these molecules, the protein-coding sequences of a major late structural polypeptide are preceded by long leader RNAs, which in some cases are thousands of nucleotides long. These sequences map to different regions of the viral genome and in one instance are separated from the late gene by more than 100 kb of DNA. Moreover, the leader sequences map either upstream or downstream of the late gene, are transcribed from either DNA strand, and are fused to the late gene coding sequence via a poly(A) stretch. This demonstrates that vaccinia virus produces late mRNAs by tagging the protein-coding sequences onto the 3′ end of other RNAs.",7/17/1987,"Bertholet, Christine; Van Meir, Erwin; ten Heggeler-Bordier, Béatrice; Wittek, Riccardo",Cell,,,TRUE,FALSE,custom_license,https://doi.org/10.1016/0092-8674(87)90211-x
63160t7f,bb790e8366da63c4f5e2d64fa7bbd5673b93063c,Elsevier,Discontinuous transcription or RNA processing of vaccinia virus late messengers results in a 5′ poly(A) leader,10.1016/0092-8674(87)90212-1,,3594569,els-covid,"Abstract We have demonstrated by primer elongation and cap analysis that mature vaccinia virus late transcripts are discontinuously synthesized. We have shown that RNA transcripts from a translocated 11K and from the authentic 11K and 4b late promoters are extended by approximately 35 nucleotides beyond the “start site” determined by S1 mapping using vaccinia genomic DNA as a probe. Sequencing of the RNA and of the first strand cDNA reveal that a homopolymeric poly(A) sequence is linked to the 5′ terminus of the RNA transcripts. S1 mapping of RNA transcripts with a DNA probe containing an A-stretch, replacing promoter sequences upstream of position −1, confirms the existence of a poly(A) leader of approximately 35 A-residues.",7/17/1987,"Schwer, Beate; Visca, Paolo; Vos, Jan C.; Stunnenberg, Hendrik G.",Cell,,,TRUE,FALSE,custom_license,https://doi.org/10.1016/0092-8674(87)90212-1
9z8wyts0,,Elsevier,A short sequence in the COOH-terminus makes an adenovirus membrane glycoprotein a resident of the endoplasmic reticulum,10.1016/0092-8674(87)90226-1,,2954653,els-covid,"Abstract The E19 protein of adenoviruses is a transmembrane protein that abrogates the intracellular transport of class I antigens by forming complexes with them in the ER. We show here that the E19 protein is retained in the ER even in the absence of class I antigens. To define the region conferring residency in the ER, we examined two mutant forms of the viral protein. A 5 amino acid extension of the 15-membered cytoplasmic tail of the protein reduces its interaction with class I antigens but does not change its intracellular distribution. Shortening the tail to 7 amino acids also diminishes the affinity for class I antigens; however, this mutant E19 protein becomes transported to the cell surface. Thus, we concluded that a small stretch of amino acids exposed on the cytoplasmic side of the ER membrane is responsible for the retention of the E19 protein in the ER.",7/17/1987,"Pääbo, Svante; Bhat, Bheem M.; Wold, William S.M.; Peterson, Per A.",Cell,,,FALSE,FALSE,custom_license,https://doi.org/10.1016/0092-8674(87)90226-1
hpv6916w,da4802204aa65bbee71cb13f97143c6318dc59e1,Elsevier,A trans-spliced leader sequence on actin mRNA in C. elegans,10.1016/0092-8674(87)90613-1,,,els-covid,"Abstract While determining the 5′ ends of C. elegans actin mRNAs, we have discovered a 22 nucleotide spliced leader sequence. The leader sequence is found on mRNA from three of the four nematode actin genes. The leader also appears to be present on some, but not all, nonactin mRNAs. The actin mRNA leader sequence is identical to the first 22 nucleotides of a novel 100 nucleotide RNA transcribed adjacent, and in the opposite orientation, to the 5S ribosomal gene. The evidence suggests that the actin mRNA leader sequence is acquired from this novel nucleotide transcript by an intermolecular trans-splicing mechanism.",6/19/1987,"Krause, Michael; Hirsh, David",Cell,,,TRUE,FALSE,custom_license,https://doi.org/10.1016/0092-8674(87)90613-1
kkkjl0le,618af94e679636181030cd0fa230d5e0224ff0b9,Elsevier,Signals for ribosomal frameshifting in the rous sarcoma virus gag-pol region,10.1016/0092-8674(88)90031-1,,2846182,els-covid,"Abstract The gag-pol protein of Rous sarcoma virus (RSV), the precursor to the enzymes responsible for reverse transcription and integration, is expressed from two genes that lie in different translational reading frames by ribosomal frameshifting. Here, we localize the site of frameshifting and show that the frameshifting reaction is mediated by slippage of two adjacent tRNAs by a single nucleotide in the 5′ direction. The gag terminator, which immediately follows the frameshift site, is not required for frameshifting. Other suspected retroviral frameshift sites mediate frameshifting when placed at the end of RSV gag. Mutations in RSV pol also affect synthesis of the gag-pol protein in vitro. The effects of these mutations best correlate with the potential to form an RNA stem-loop structure adjacent to the frameshift site. A short sequence of RSV RNA, 147 nucleotides in length, containing the frameshift site and stem-loop structure, is sufficient to direct frameshifting in a novel genetic context.",11/4/1988,"Jacks, Tyler; Madhani, Hiten D.; Masiarz, Frank R.; Varmus, Harold E.",Cell,,,TRUE,FALSE,custom_license,https://doi.org/10.1016/0092-8674(88)90031-1
996kl9jz,5f6409c09c836569e3596acc90b0a0f5f41ef685,Elsevier,Biased hypermutation and other genetic changes in defective measles viruses in human brain infections,10.1016/0092-8674(88)90048-7,,3167982,els-covid,"Abstract We assessed the alterations of viral gene expression occurring during persistent infections by cloning full-length transcripts of measles virus (MV) genes from brain autopsies of two subacute sclerosing panencephalitis patients and one measles inclusion body encephalitis (MIBE) patient. The suquence of these MV genes revealed that, most likely, almost 2% of the nucleotides were mutated during persistence, and 35% of these differences resulted in amino acid changes. One of these nucleotide substitutions and one deletion resulted in alteration of the reading frames of two fusion genes, as confirmed by in vitro translation of synthetic mRNAs. One cluster of mutations was exceptional; in the matrix gene of the MIBE case, 50% of the U residues were changed to C, which might result from a highly biased copying event exclusively affecting this gene. We propose that the cluster of mutations in the MIBE case, and other combinations of mutations in other cases, favored propagation of MV infections in brain cells by conferring a selective advantage to the mutated genomes.",10/21/1988,"Cattaneo, Roberto; Schmid, Anita; Eschle, Daniel; Baczko, Knut; ter Meulen, Volker; Billeter, Martin A.",Cell,,,TRUE,FALSE,custom_license,https://doi.org/10.1016/0092-8674(88)90048-7
uppekume,1df8240e340b8b6c45fe53e14e440bb59b5cc38d,Elsevier,ProOmpA is stabilized for membrane translocation by either purified E. coli trigger factor or canine signal recognition particle,10.1016/0092-8674(88)90115-8,,2843289,els-covid,"Abstract We have isolated large amounts of E. coli outer-membrane protein A precursor (proOmpA). Purified proOmpA is active in membrane assembly, and this assembly is saturable with respect to the precursor protein. A proOmpA-Sepharose matrix allows affinity isolation of trigger factor, a soluble, 63,000 dalton monomeric protein that stabilizes proOmpA in assembly competent form. Comparison of trigger factor's amino-terminal sequence with those in a computer data bank and with those encoded by sec genes, as well as groEL and heat shock gene dnaK, suggests that trigger factor is encoded by a previously undescribed gene. Trigger factor and proOmpA form a 1:1 complex that can be isolated by gel filtration. Purified canine signal recognition particle (SRP) can also stabilize proOmpA for membrane insertion. This post-ribosomal activity of SRP suggests a unifying theme in protein translocation mechanisms.",9/23/1988,"Crooke, Elliott; Guthrie, Brenda; Lecker, Stewart; Lill, Roland; Wickner, William",Cell,,,TRUE,FALSE,custom_license,https://doi.org/10.1016/0092-8674(88)90115-8
5caapdld,a486e06ce68672ffe53a1fe439c5409854fcb96b,Elsevier,Insulin-dependent diabetes mellitus induced in transgenic mice by ectopic expression of class II MHC and interferon-gamma,10.1016/0092-8674(88)90414-x,,2449974,els-covid,"Abstract We have produced transgenic mouse strains harboring class II major histocompatibility complex or interferon-gamma genes linked to the human insulin promoter. These experiments were designed to investigate the consequences of the expression of immunological effector molecules by nonimmunological cells. In both of these studies we observed the disappearance from the pancreas of the insulin-producing β cells coinciding with the development of insulin-dependent diabetes mellitus. Transgenic mice expressing both chains of the I-A gene showed progressive atrophy of the islets of Langerhans, whereas mice expressing interferon-gamma suffered an inflammatory destruction of the islets.",3/11/1988,"Sarvetnick, Nora; Liggitt, Denny; Pitts, Sharon L.; Hansen, Stanley E.; Stewart, Timothy A.",Cell,,,TRUE,FALSE,custom_license,https://doi.org/10.1016/0092-8674(88)90414-x
5i3g2zb7,ceb567e504b717d421b4f7a191945236d885acd8,Elsevier,Characterization of an efficient coronavirus ribosomal frameshifting signal: Requirement for an RNA pseudoknot,10.1016/0092-8674(89)90124-4,,2720781,els-covid,"Abstract The genomic RNA of the coronavirus IBV contains an efficient ribosomal frameshifting signal at the junction of two overlapping open reading frames. We have defined by deletion analysis an 86 nucleotide sequence encompassing the overlap region which is sufficient to allow frameshifting in a heterologous context. The upstream boundary of the signal consists of the sequence UUUAAAC, which is the likely site of ribosomal slippage. We show by creation of complementary nucleotide changes that the RNA downstream of this “slippery” sequence folds into a tertiary structure termed a pseudoknot, the formation of which is essential for efficient frameshifting.",5/19/1989,"Brierley, Ian; Digard, Paul; Inglis, Stephen C.",Cell,,,TRUE,FALSE,custom_license,https://doi.org/10.1016/0092-8674(89)90124-4
649lc4fs,a9dee13fda3ced0266934acdee7f68ec5fd64e53,Elsevier,Evidence that the leukocyte-common antigen is required for antigen-induced T lymphocyte proliferation,10.1016/0092-8674(89)90504-7,,2550143,els-covid,"Abstract The leukocyte-common antigen (L-CA) is a family of large molecular weight glycoproteins uniquely expressed on the surface of all nucleated cells of hematopoletic origin. The glycoprotein consists of a heavily glycosylated exterior domain, a single membrane spanning region, and a large cytoplasmic domain that contains tyrosine phosphatase activity. To investigate the function of this family, we generated T cell clones that lacked L-CA (L-CA−). The expression of the αβ T cell receptor, CD3, CD4, IL-2 receptor (p55), LFA-1, Thy-1, and Pgp-1 (CD44) was normal. The L-CA− T cell clones failed to proliferate in response to antigen or cross-linked CD3; however, they could still proliferate in response to IL-2. An L-CA+ revertant was obtained and the ability to proliferate in response to antigen and cross-linked CD3 was restored. These data indicate that L-CA is required for T cells to enter into cell cycle in response to antigen.",9/22/1989,"Pingel, Jeanette T.; Thomas, Matthew L.",Cell,,,TRUE,FALSE,custom_license,https://doi.org/10.1016/0092-8674(89)90504-7
fj7sf345,bbf64f06dd52b41672d4f3a8e6364969643086eb,Elsevier,Cell-free protein sorting to the regulated and constitutive secretory pathways,10.1016/0092-8674(90)90097-x,,2138058,els-covid,"Abstract To elucidate the mechanism of secretory granule formation, we here identify the first intermediate in this process, the immature secretory granule, in the neuroendocrine cell line PC12 and demonstrate the packaging of a regulated secretory protein, secretogranin II, to immature secretory granules in a cell-free system. The formation of immature secretory granules was as fast ( t 1 2 ≈ 5 min ) as that of constitutive secretory vesicles identified by the presence of a rapidly secreted heparan sulfate proteoglycan. Using the cell-free system, the formation of post-Golgi secretory vesicles was found to be dependent upon ATP. Two distinct populations of vesicles were formed: immature secretory granules containing secretogranin II and constitutive secretory vesicles containing the heparan sulfate proteoglycan. These results show that in a cell-free system, a constitutive and a regulated secretory protein are sorted upon exit from the trans-Golgi network.",3/9/1990,"Tooze, Sharon A.; Huttner, Wieland B.",Cell,,,TRUE,FALSE,custom_license,https://doi.org/10.1016/0092-8674(90)90097-x
1v24jg3k,,Elsevier,A nascent peptide is required for ribosomal bypass of the coding gap in bacteriophage T4 gene 60,10.1016/0092-8674(90)90245-a,,,els-covid,"Abstract Bacteriophage T4 DNA topoisomerase gene 60 contains a 50 nucleotide untranslated region within the coding sequence of its mRNA. Translational bypass of this sequence by elongating ribosomes has been postulated for the mode of synthesis of an 18 kd polypeptide specified by the split coding segments. Ribosome bypass of the untranslated region also occurs when a segment of gene 60 is fused to lacZ and expressed in E. coli. The efficiency of bypass in these gene 60-lacZ fusions approaches 100%. Here, mutations that delete, insert, or substitute nucleotides from gene 60-lacZ fusions are examined. Essential features necessary for high level gap bypass emerging from this analysis are a cis-acting nascent peptide sequence, a short duplication bordering the gap, and a stop codon contained in a stem-loop structure at the 5′ junction of the gap.",7/13/1990,"Weiss, Robert B.; Huang, Wai Mun; Dunn, Diane M.",Cell,,,FALSE,FALSE,custom_license,https://doi.org/10.1016/0092-8674(90)90245-a
xk4yuibj,f65bd12c7c03725e764af2781e0142d6ea2a22c9,Elsevier,Ribosomal frameshifting in the yeast retrotransposon Ty: tRNAs induce slippage on a 7 nucleotide minimal site,10.1016/0092-8674(90)90371-k,,2164889,els-covid,"Abstract Ribosomal frameshifting regulates expression of the TYB gene of yeast Ty retrotransposons. We previously demonstrated that a 14 nucleotide sequence conserved between two families of Ty elements was necessary and sufficient to support ribosomal frameshifting. This work demonstrates that only 7 of these 14 nucleotides are needed for normal levels of frameshifting. Any change to the sequence CUU-AGG-C drastically reduces frameshifting; this suggests that two specific tRNAs, tRNALeu UAG and tRNAArg CCU, are involved in the event. Our tRNA overproduction data suggest that a leucyl-tRNA, probably tRNALeu UAG, an unusual leucine isoacceptor that recognizes all six leucine codons, slips from CUU-Leu onto UUA-Leu (in the +1 reading frame) during a translational pause at the AGG-Arg codon induced by the low availability of tRNAArg CCU, encoded by a single-copy essential gene. Frameshifting is also directional and reading frame specific. Interestingly, frameshifting is inhibited when the “slip” CUU codon is located three codons downstream, but not four or more codons downstream, of the translational initiation codon.",7/27/1990,"Belcourt, Michael F.; Farabaugh, Philip J.",Cell,,,TRUE,FALSE,custom_license,https://doi.org/10.1016/0092-8674(90)90371-k
jyqpziqw,6d6350eb2553fea515124b97281d151b13a537c9,Elsevier,"A brefeldin A-like phenotype is induced by the overexpression of a human ERD-2-like protein, ELP-1",10.1016/0092-8674(92)90226-3,,1316805,els-covid,"Abstract Brefeldin A (BFA) is a unique drug affecting the molecular mechanisms that regulate membrane traffic and organelle structure. BFA's ability to alter retrograde traffic from the Golgi to the endoplasmic reticulum (ER) led us to ask whether the ERD-2 retrieval receptor, proposed to return escaped ER resident proteins from the Golgi, might either interfere with or mimic the effects of the drug. When either human ERD-2 or a novel human homolog (referred to as ELP-1) is overexpressed in a variety of cell types, the effects are phenotypically indistinguishable from the addition of BFA. These include the redistribution of the Golgi coat protein, β-COP, to the cytosol, the loss of the Golgi apparatus as a distinct organelle, the mixing of this organelle with the ER, the addition of complex oligosaccharides to resident ER glycoproteins, and the block of anterograde traffic. Thus, these receptors may provide signals that regulate retrograde traffic between the Golgi and the ER.",5/15/1992,"Hsu, Victor W.; Shah, Nicky; Klausner, Richard D.",Cell,,,TRUE,FALSE,custom_license,https://doi.org/10.1016/0092-8674(92)90226-3
byxd4o4m,36d81dfe6a86cf8bfe344eeb9fdf0dc32c40894c,Elsevier,Identification of essential components of the S. cerevisiae kinetochore,10.1016/0092-8674(93)90255-o,,8500169,els-covid,"Abstract We have designed and utilized two in vivo assays of kinetochore integrity in S. cerevisiae. One assay detects relaxation of a transcription block formed at centromeres; the other detects an increase in the mitotic stability of a dicentric test chromosome. ctf13-30 and ctf14-42 were identified as putative kinetochore mutants by both assays. CTF14 is identical to NDC10 CBF2 , a recently identified essential gene that encodes a 110 kd kinetochore component. CTF13 is an essential gene that encodes a predicted 478 amino acid protein with no homology to known proteins. ctf13 mutants missegregate chromosomes at permissive temperature and transiently arrest at nonpermissive temperature as large-budded cells with a G2 DNA content and a short spindle. Antibodies recognizing epitope-tagged CTF13 protein decrease the electrophoretic mobility of a CEN DNA-protein complex formed in vitro. Together, the genetic and biochemical data indicate that CTF13 is an essential kinetochore protein.",5/21/1993,"Doheny, Kimberly Floy; Sorger, Peter K.; Hyman, Anthony A.; Tugendreich, Stuart; Spencer, Forrest; Hieter, Philip",Cell,,,TRUE,FALSE,custom_license,https://doi.org/10.1016/0092-8674(93)90255-o
hmn7mg8j,947c815bad6c2c222b5bac151e05abb0fbd76b07,Elsevier,Three-dimensional visualization of the rotavirus hemagglutinin structure,10.1016/0092-8674(93)90516-s,,8395350,els-covid,"Abstract Three-dimensional structures of a native simian and reassortant rotavirus have been determined by electron cryomicroscopy and computer image processing. The structural features of the native virus confirm that the hemagglutinin spike is a dimer of VP4, substantiated by in vivo radiolabeling studies. Exchange of native VP4 with a bovine strain equivalent results in a poorly infectious reassortant. No VP4 spikes are detected in the three-dimensional reconstruction of the reassortant. The difference map between the two structures reveals a novel large globular domain of VP4 buried within the virion that interacts extensively with the intermediate shell protein, VP6. Our results suggest that assembly of VP4 precedes that of VP7, the major outer shell protein, and that VP4 may play an important role in the receptor recognition and budding process through the rough endoplasmic reticulum during virus maturation.",8/27/1993,"Shaw, A.L.; Rothnagel, R.; Chen, D.; Ramig, R.F.; Chiu, W.; Prasad, B.V.Venkataram",Cell,,,TRUE,FALSE,custom_license,https://doi.org/10.1016/0092-8674(93)90516-s
xzusv5zj,c34cabbd91790803305f15cda1a6514b31d8b71e,Elsevier,Molecular mimicry in T cell-mediated autoimmunity: Viral peptides activate human T cell clones specific for myelin basic protein,10.1016/0092-8674(95)90348-8,,7534214,els-covid,"Abstract Structural similarity between viral T cell epitopes and self-peptides could lead to the induction of an autoaggressive T cell response. Based on the structural requirements for both MHC class 11 binding and TCR recognition of an immunodominant myelin basic protein (MBP) peptide, criteria for a data base search were developed in which the degeneracy of amino acid side chains required for MHC class 11 binding and the conservation of those required for T cell activation were considered. A panel of 129 peptides that matched the molecular mimicry motif was tested on seven MBP-specific T cell clones from multiple sclerosis patients. Seven viral and one bacterial peptide efficiently activated three of these clones. Only one peptide could have been identified as a molecular mimic by sequence alignment. The observation that a single T cell receptor can recognize quite distinct but structurally related peptides from multiple pathogens has important implications for understanding the pathogenesis of autoimmunity.",3/10/1995,"Wucherpfennig, Kai W; Strominger, Jack L",Cell,,,TRUE,FALSE,custom_license,https://doi.org/10.1016/0092-8674(95)90348-8
