shp66rj9,,Elsevier,Establishing a genetic recombination map for murine coronavirus strain A59 complementation groups,10.1016/0042-6822(90)90530-5,,,els-covid,"Abstract MHV-A59 temperature-sensitive mutants, representing one RNA+ and five RNA− complementation groups, were isolated and characterized by genetic recombination techniques. Maximum recombination frequencies occurred under multiplicities of infection greater than 10 each in which 99.99% of the cells were co-infected. Recombination frequencies between different is mutants increased steadily during infection and peaked late in the virus growth cycle. These data suggest that recombination is a late event in the virus replication cycle. Recombination frequencies were also found to range from 63 to 20,000 times higher than the sum of the spontaneous reversion frequencies of each is mutant used in the cross. Utilizing standard genetic recombination techniques, the five RNA− complementation groups of MHV-A59 were arranged into an additive, linear, genetic map located at the 5′ end of the genome in the 23-kb polymerase region. These data indicate that at least five distinct functions are encoded in the MHV polymerase region which function in virus transcription. Moreover, using well-characterized is mutants the recombination frequency for the entire 32-kb MHV genome was found to approach 25% or more. This is the highest recombination frequency described for a nonsegmented, linear, plus-polarity RNA virus.",8/31/1990,"Baric, Ralph S.; Fu, Kaisong; Schaad, Mary C.; Stohlman, Stephen A.",Virology,,,FALSE,FALSE,custom_license,https://doi.org/10.1016/0042-6822(90)90530-5
5rovh1xf,75e66da0fccbae4e094e2ff72e3fff10dc9c3be9,Elsevier,Map location of lactate dehydrogenase-elevating virus (LDV) capsid protein (Vpl) gene,10.1016/0042-6822(90)90546-4,,2371780,els-covid,"Abstract Lactate dehydrogenase-elevating virus (LDV) is currently classified within the Togaviridae family. In an effort to obtain further information on the characteristics of this virus, we have begun to sequence the viral RNA genome and to map the virion structural protein genes. A sequence of 1064 nucleotides, which represents the 3′ terminal end of the genome, was obtained from LDV cDNA clones. A 3′ noncoding region of 80 nucleotides followed by two complete open reading frames (ORFs) were found within this sequence. The two ORFs were in different reading frames and overlapped each other by 11 nucleotides. One ORF encoded a protein of 170 amino acids and the other ORF, located adjacent to the 3′ noncoding region of the viral genome, encoded a 114 amino acid protein. Thirty-three N-terminal residues were sequenced directly from purified LDV capsid protein, Vpi, and this amino acid sequence mapped to the ORF adjacent to the 3′ noncoding region. The presence of overlapping ORFs and the 3′ terminal map position of Vpi indicate that LDV differs significantly from the prototype alpha togaviruses.",8/31/1990,"Godeny, E.K.; Speicher, D.W.; Brintow, M.A.",Virology,,,TRUE,FALSE,custom_license,https://doi.org/10.1016/0042-6822(90)90546-4
7isxu2jm,9dd55fd0a85ac293d72b4c64589532f28d2a6962,Elsevier,Differentiation of acid-ph-dependent and -nondependent entry pathways for mouse hepatitis virus,10.1016/0042-6822(91)90014-3,,1845820,els-covid,"Abstract Early events of infection of MHV were studied in comparison with those of VSV, which is known to enter cells by an endocytic pathway. Treatment of mouse L-2 fibroblasts with ammonium chloride, chloroquine, or dansylcadaverine inhibited infection of MHV to a much lesser degree than that of VSV, suggesting a relatively minor role for the endocytic pathway and functional endosomes in MHV infection. Endocytosis of MHV and VSV into L-2 cells was assayed by the recovery of infectious (i.e., not uncoated) viruses from homogenates of cells harvested within the first few minutes of infection (and treated with protease to remove surface-bound virus). The results thus suggest that while a small proportion of the MHV inoculum is internalized by endocytosis, productive infection does not depend on functional endocytosis as utilized by VSV. Studies on direct virion-mediated cell fusion showed that MHV can induce fusion at pH 7.4, whereas VSV causes fusion at pH 5.0. Taken together, the above results suggest that MHV enters L-2 cells predominantly by membrane fusion with a non-acidified compartment such as the plasma membrane, endocytic vesicles, or endosomes (prior to their acidification). Results obtained from cell lines which differed in permissiveness to MHV infection suggested that the ability to support MHV infection does not correlate with endocytosis. Rather, nonpermissive cells, such as rat astrocytoma (C-6) and Vero cells, showed higher levels of recoverable internalized MHV than did fully permissive L-2 cells. Cells which are normally nonpermissive to MHV, could be rendered MHV-susceptible by PEG-induced fusion of cell surface-bound virus. Such PEG-mediated susceptibility to MHV infection was insensitive to inhibition by ammonium chloride, supporting the idea that host cell restriction of MHV infection in C-6 and Vero cells may be due to a block in nonendosomal membrane fusion. Thus endocytic internalization of MHV, which clearly occurs in a variety of cells, does not guarantee productive infection.",1/31/1991,"Kooi, Cora; Cervin, Marguerite; Anderson, Robert",Virology,,,TRUE,FALSE,custom_license,https://doi.org/10.1016/0042-6822(91)90014-3
03vk6enj,39fdb226d49fbecc481437ec6c956f9fd378d247,Elsevier,Isolated HE-protein from hemagglutinating encephalomyelitis virus and bovine coronavirus has receptor-destroying and receptor-binding activity,10.1016/0042-6822(91)90026-8,,1984649,els-covid,"Abstract Bovine coronavirus (BCV) and hemagglutinating encephalomyelitis virus (HEV) from swine were found to grow to high titers in MDCK I cells, a subline of Madin Darby canine kidney cells. Virus grown in these cells was used to isolate and purify the HE-protein. This protein has been shown recently to have acetylesterase activity and to function as the receptor-destroying enzyme of BCV. Here we show that HEV contains this enzyme, too. The glycoproteins were solubilized by treatment of virions with octylglucoside. Following centrifugation through a sucrose gradient the surface proteins S and HE (hemagglutinin-esterase) were obtained in purified form. After removal of the detergent by dialysis, HE formed rosettes as shown by electron microscopy. The purified HE protein retained acetylesterase activity and was able to function as a receptor-destroying enzyme rendering red blood cells resistant against agglutination by both coronaviruses. HE protein released from the viral membrane failed to agglutinate red blood cells. However, it was found to recognize glycoconjugates containing N-acetyl-9-O-acetylneuraminic acid as indicated by a binding assay with rat serum proteins blotted to nitrocellulose and by its ability to inhibit the hemagglutinating activity of BCV, HEV, and influenza C virus. The purified enzyme provides a useful tool for analyzing the cellular receptors for coronaviruses.",1/31/1991,"Schultze, Beate; Wahn, Kurt; Klenk, Hans-Dieter; Herrler, Georg",Virology,,,TRUE,FALSE,custom_license,https://doi.org/10.1016/0042-6822(91)90026-8
fky0cm5e,b215cc0bcde57d607b40cbad413ad672abbd775b,Elsevier,The S2 subunit of the spike glycoprotein of bovine coronavirus mediates membrane fusion in insect cells,10.1016/0042-6822(91)90045-d,,1984658,els-covid,"Abstract The hemagglutinin/esterase (HE), spike precursor (S) and the S1 and S2 subunits of the spike precursor protein of bovine coronavirus were expressed in Spodoptera frugiperda (Sf9) cells, and the cell-fusing activity of each recombinant glycoprotein was examined. Extensive syncytia formation was observed in cells infected with the S2 recombinant but not with the HE or S1 recombinant baculoviruses. Fusion of Sf9 cells expressing the intact S protein precursor was evident after trypsin treatment. These results demonstrate that proteolytic cleavage of the S spike precursor is required for fusion induction and that the fusion is mediated by the S2 subunit. These observations may reflect the biological role of the S2 subunit in fusion-penetration during bovine coronavirus infection.",1/31/1991,"Yoo, Dongwan; Parker, Michael D.; Babiuk, Lorne A.",Virology,,,TRUE,FALSE,custom_license,https://doi.org/10.1016/0042-6822(91)90045-d
x1dv7ag8,dd54bf9fef4a43620b37608eafdb9d751d20829e,Elsevier,Comparison of the genome organization of toro- and coronaviruses: Evidence for two nonhomologous RNA recombination events during berne virus evolution,10.1016/0042-6822(91)90056-h,,1984666,els-covid,"Abstract Recently, toroviruses and coronaviruses have been found to be ancestrally related by divergence of their polymerase and envelope proteins from common ancestors. In addition, their genome organization and expression strategy, which involves the synthesis of a 3′-coterminal nested set of mRNAs, are comparable. Nucleotide sequence analysis of the genome of the torovirus prototype, Berne virus (BEV), has now revealed the results of two independent nonhomologous RNA recombinations during torovirus evolution. Berne virus open reading frame (ORF) 4 encodes a protein with significant sequence similarity (30–35% identical residues) to a part of the hemagglutinin esterase proteins of corona-viruses and influenza virus C. The sequence of the C-terminal part of the predicted BEV polymerase ORF1a product contains 31–36% identical amino acids when compared with the sequence of a nonstructural 30 32K corona-virus protein. The cluster of coronaviruses which contains this nonstructural gene expresses it not as a part of their polymerase, but by synthesizing an additional subgenomic mRNA.",1/31/1991,"Snijder, Eric J.; Den Boon, Johan A.; Horzinek, Marian C.; Spaan, Willy J.M.",Virology,,,TRUE,FALSE,custom_license,https://doi.org/10.1016/0042-6822(91)90056-h
bam3pa70,3d08b0acba6b0466f5713034bd19745c9a79b124,Elsevier,The complete sequence (22 kilobases) of murine coronavirus gene 1 encoding the putative proteases and RNA polymerase,10.1016/0042-6822(91)90071-i,,,els-covid,"Abstract The 5′-most gene, gene 1, of the genome of murine coronavirus, mouse hepatitis virus (MHV), is presumed to encode the viral RNA-dependent RNA polymerase. We have determined the complete sequence of this gene of the JHM strain by cDNA cloning and sequencing. The total length of this gene is 21,798 nucleotides long, which includes two overlapping, large open reading frames. The first open reading frame, ORF 1 a, is 4488 amino acids long. The second open reading frame, ORF 1 b, overlaps ORF 1 a for 75 nucleotides, and is 2731 amino acids long. The overlapping region may fold into a pseudoknot RNA structure, similar to the corresponding region of the RNA of avian coronavirus, infectious bronchitis virus (IBV). The in vitro transcription and translation studies of this region indicated that these two ORFs were most likely translated into one polyprotein by a ribosomal frameshifting mechanism. Thus, the predicted molecular weight of the gene 1 product is more than 800,000 Da. The sequence of ORF 1 b is very similar to the corresponding ORF of IBV. In contrast, the ORF 1 a of these two viruses differ in size and have a high degree of divergence. The amino acid sequence analysis suggested that ORF 1 a contains several functional domains, including two hydrophobic, membrane-anchoring domains, and three cysteine-rich domains. It also contains a picornaviral 3C-like protease domain and two papain-like protease domains. The presence of these protease domains suggests that the polyprotein is most likely processed into multiple protein products. In contrast, the ORF 1b contains polymerase, helicase, and zinc-finger motifs. These sequence studies suggested that the MHV gene 1 product is involved in RNA synthesis, and that this product is processed autoproteolytically after translation. This study completes the sequence of the MHV genome, which is 31 kb long, and constitutes the largest viral RNA known.",2/28/1991,"Lee, Han-Jung; Shieh, Chien-Kou; Gorbalenya, Alexander E.; Koonin, Eugene V.; La Monica, Nicola; Tuler, Jeremy; Bagdzhadzhyan, Anush; Lai, Michael M.C.",Virology,,,TRUE,FALSE,custom_license,https://doi.org/10.1016/0042-6822(91)90071-i
y7t47t7a,e3a94077b5bd542508ac66b664fce9222b5423ff,Elsevier,Structural characteristics of the M2 protein of influenza a viruses: Evidence that it forms a tetrameric channe,10.1016/0042-6822(91)90075-m,,1989386,els-covid,"Abstract The evidence presented shows that the M2 protein of influenza A viruses exists in infected cells as a homotetramer composed of two disulfide-linked dimers held together by noncovalent interactions. The amphiphilic nature of the transmembrane α-helical domain is consistent with the protein forming a transmembrane channel with which amantadine, the specific anti-influenza A drug, interacts. Together these features provide a structural basis for the hypothesis that M2 has a proton translocation function capable of regulating the pH of vesicles of the trans-Golgi network, a role important in promoting the correct maturation of the hemagglutinin glycoprotein.",2/28/1991,"Sugrue, R.J.; Hay, A.J.",Virology,,,TRUE,FALSE,custom_license,https://doi.org/10.1016/0042-6822(91)90075-m
kewcn5s7,a56ce5fa4ee093c053550da1a5c51a4a9e6192db,Elsevier,Structural analysis of the conformational domains involved in neutralization of bovine coronavirus using deletion mutants of the spike glycoprotein S1 subunit expressed by recombinant baculoviruses,10.1016/0042-6822(91)90121-q,,2053298,els-covid,"Abstract Two conformation-dependent neutralizing epitopes, A and B, have been mapped to the S1 subunit of the S spike glycoprotein of bovine coronavirus (BCV). In order to characterize the structure of these antigenic sites, we constructed a series of cDNA clones encoding deleted or truncated S1 derivatives and expressed the modified genes in insect cells using recombinant baculoviruses. Monoclonal antibodies directed against epitopes A and B recognized only the mutant S1 polypeptides containing amino acids 324–720, as demonstrated by immunoprecipitation and Western blot analysis in the absence of β-mercaptoethanol. In addition, two domains within this region were identified and only mutants containing both domains were immunoreactive, indicating that both were critical in the formation of the antigenic determinants. One domain was localized between residues 324 and 403 and the other at residues 517–720. Deletion of either domain inhibited extracellular secretion of the mutant proteins whereas mutants containing both or none of the domains were secreted efficiently. This observation suggests a vital function of the native conformation of the S1 protein in both antigenic structure and intracellular transport. Antigenic determinants A and B were not distinguished, but these determinants appeared to require both domains for epitope formation. Our results suggest that the antigenic determinants formed by two domains are likely associated with the probable polymorphic region of the BCV S1 subunit.",7/31/1991,"Yoo, Dongwan; Parker, Michael D.; Song, Jaeyoung; Cov, Graham J.; Deregt, Dirk; Babiuk, Lorne A.",Virology,,,TRUE,FALSE,custom_license,https://doi.org/10.1016/0042-6822(91)90121-q
20fhpmfg,b8ec28f3c2715b093276bae81ebed75853b2f010,Elsevier,Expression and frameshifting but extremely inefficient proteolytic processing of the HIV-1 gag and pol gene products in stably transfected rodent cell lines,10.1016/0042-6822(91)90134-w,,2053281,els-covid,"Abstract Expression, ribosomal frameshifting, and proteolytic processing of HIV-1 GAG and POL proteins were investigated in heterologous mammalian cells in order to elucidate the influence of the cellular background on these events. DNA fragments encoded by the gag and pol region were expressed in two rodent cell lines, LTK- and BHK. Both stably transfected cell lines continuously produce recombinant proteins which react with HIV-specific antisera. The GAG precursor and a 39-kDa proteolytic fragment thereof were the major recombinant proteins detected. Expression of the gag-pol region leads to the production of the GAG-POL precursor. Ribosomal frameshifting at the HIV-1 shifty sequence to a typical extent could be positively demonstrated by an enzyme assay. Despite the presence of the viral protease within the GAG-POL precursors, proteolytic processing of the HIV-derived polyproteins was extremely inefficient. The efficiency could not be enhanced by overexpression of the HIV-1 protease encoding region.",7/31/1991,"Moosmayer, Dieter; Reil, Heide; Ausmeier, Martina; Scharf, Jens-Gerd; Hauser, Hansjorg; Jentsch, Klaus Dieter; Hunsmann, Gerhard",Virology,,,TRUE,FALSE,custom_license,https://doi.org/10.1016/0042-6822(91)90134-w
qf32xs4m,92e8361337fbac731af5b69de79ed5465011ed24,Elsevier,Residues involved in the antigenic sites of transmissible gastroenteritis coronavirus S glycoprotein,10.1016/0042-6822(91)90135-x,,1711257,els-covid,"Abstract The S glycoprotein of transmissible gastroenteritis virus (TGEV) has been shown to contain four major antigenic sites (A, B, C, and D). Site A is the main inducer of neutralizing antibodies and has been previously subdivided into the three subsites Aa, Ab, and Ac. The residues that contribute to these sites were localized by sequence analysis of 21 mutants that escaped neutralization or binding by TGEV-specific monoclonal antibodies (MAbs), and by epitope scanning (PEPSCAN). Site A contains the residues 538, 591, and 543, which are essential in the formation of subsites Aa, Ab, and Ac, respectively. In addition, mar mutant 1B.H6 with residue 586 changed had partially altered both subsite Aa and Ab, indicating that these subsites overlap in residue 586; i.e. this residue also is part of site A. The peptide 537-MKSGYGQPIA-547 represents, at least partially, subsite Ac which is highly conserved among coronaviruses. This site is relevant for diagnosis and could be of interest for protection. Other residues contribute to site B (residues 97 and 144), site C (residues 50 and 51), and site D (residue 385). The location of site D is in agreement with PEPSCAN results. Site C can be represented by the peptide 48-P-P/S-N-S-D/E-52 but is not exposed on the surface of native virus. Its accessibility can be modulated by treatment at pH >11 (at 4°) and temperatures >45°. Sites A and B are fully dependent on glycosylation for proper folding, while sites C and D are fully or partially independent of glycosylation, respectively. Once the S glycoprotein has been assembled into the virion, the carbohydrate moiety is not essential for the antigenic sites.",7/31/1991,"Gebauer, Fátima; Posthumus, Willem P.A.; Correa, Isabel; Sae, Carlos; Smerdou, Cristian; Sanchez, Carlos M.; Lenstra, Johannes A.; Meloen, Rob H.; Enjuanes, Luis",Virology,,,TRUE,FALSE,custom_license,https://doi.org/10.1016/0042-6822(91)90135-x
nshwzkir,2a3b3726934b167b9487f28a32e1f84305846459,Elsevier,cis acting RNA sequences control the gag-pol translation readthrough in murine leukemia virus,10.1016/0042-6822(91)90144-z,,2053284,els-covid,"Abstract The pol gene of the Moloney murine leukemia virus (M-MuLV) is expressed as a Gag-Pol fusion protein through an in-frame suppression of the UAG termination codon located between the two genes. The role of nucleotide context in suppression was investigated, in a rabbit reticulocyte lysate translation system, using site-directed mutagenesis. The results indicate that the translational readthrough is mediated by at least 50 bases long RNA sequence located 3′ to the gag UAG termination codon. Within this sequence a short purine-rich sequence adjacent to the amber codon, highly conserved among different retroviruses, appears essential for M-MuLV suppression. Two alternative putative stem and loop like RNA structures can be drawn at the gag-pol junction, one abutting the gag UAG codon, and the second downstream to it. None of these structures appears to be important to the suppression process.",7/31/1991,"Honigman, Alik; Wolf, Dana; Yaish, Shoshanit; Falk, Haya; Panet, Amos",Virology,,,TRUE,FALSE,custom_license,https://doi.org/10.1016/0042-6822(91)90144-z
a1skdp67,7203ee00953dc742b847ad2d76e09b3be7ccb151,Elsevier,Spread of the CVS strain of rabies virus and of the avirulent mutant AvO1 along the olfactory pathways of the mouse after intranasal inoculation,10.1016/0042-6822(91)90145-2,,2053286,els-covid,"Abstract After intranasal instillation in the mouse, rabies virus (CVS strain) selectively infected olfactory receptor cells. In the main olfactory bulb (MOB), infection was observed in periglomerular, tufted, and mitral cells and in interneurons located in the internal plexiform layer. Beyond the MOB, CVS spread into the brain along the olfactory pathways. This infection is specific to chains of functionally related neurons but at the death of the animal some nuclei remain uninfected. CVS also penetrated the trigeminal system. The avirulent mutant AvOl, carrying a mutation in position 333 of the glycoprotein, infected the olfactory epithelium and the trigeminal nerve as efficiently as CVS. During the second cycle of infection, the mutant was able to infect efficiently periglomerular cells in the MOB and neurons of the horizontal limb of the diagonal band, which indicates that maturation of infective particles is not affected in primarily infected neuronal cells. On the other hand, other neuronal cells permissive for CVS, such as mitral cells or the anterior olfactory nucleus, are completely free of infection with the mutant, indicating that restriction is related to the ability of AvO1 to penetrate several categories of neurons. From these observations, we concluded that CVS should be able to bind several different receptors to penetrate neurons, while the mutant would be unable to recognize some of them.",7/31/1991,"Lafay, F.; Coulon, P.; Astic, L.; Saucier, D.; Riche, D.; Holley, A.; Flamand, A.",Virology,,,TRUE,FALSE,custom_license,https://doi.org/10.1016/0042-6822(91)90145-2
qbmcw4ck,40b271768b2444fab4c42ce4866dc88215ac43c9,Elsevier,Golgi complex localization of the Punta Toro virus G2 protein requires its association with the G1 protein,10.1016/0042-6822(91)90148-5,,1905078,els-covid,"Abstract The glycoproteins of bunyaviruses accumulate in membranes of the Golgi complex, where virus maturation occurs by budding. In this study we have constructed a series of full length or truncated mutants of the G2 glycoprotein of Punta Toro virus (PTV), a member of the Phlebovirus genus of the Bunyaviridae, and investigated their transport properties. The results indicate that the hydrophobic domain preceding the G2 glycoprotein can function as a translocational signal peptide, and that the hydrophobic domain near the C-terminus serves as a membrane anchor. A G2 glycoprotein construct with an extra hydrophobic sequence derived from the N-terminal NSM region was stably retained in the ER, and was unable to be transported to the Golgi complex. The full-length G2 glycoprotein, when expressed on its own, was transported out of the ER and expressed on the cell surface, whereas the G1 and G2 proteins when expressed together are retained in the Golgi complex. A truncated anchor-minus form of the G2 glycoprotein was found to be secreted into the culture medium, but was retained in the Golgi complex when coexpressed with the G1 glycoprotein. These results indicate that the G2 membrane glycoprotein is a class I membrane protein which does not contain a signal sufficient for Golgi retention, and suggest that its Golgi localization is a result of association with the G1 glycoprotein.",7/31/1991,"Chen, Si-Yi; Matsuoka, Yumiko; Compans, Richard W.",Virology,,,TRUE,FALSE,custom_license,https://doi.org/10.1016/0042-6822(91)90148-5
